{
  "eventId": "11111111-1111-4111-8111-111111111111",
  "eventType": "ai.job.requested.v1",
  "schemaVersion": "1.0.0",
  "occurredAt": "2026-07-13T18:00:00Z",
  "correlationId": "22222222-2222-4222-8222-222222222222",
  "causationId": null,
  "jobId": "33333333-3333-4333-8333-333333333333",
  "jobType": "DOCUMENT_EXTRACTION",
  "tenantId": "44444444-4444-4444-8444-444444444444",
  "transactionId": "55555555-5555-4555-8555-555555555555",
  "subjectId": "66666666-6666-4666-8666-666666666666",
  "idempotencyKey": "doc-minimum-2026-07-13",
  "producer": {"service": "m4trust-core", "version": "1.0.0"},
  "payload": {
    "input": {
      "documentId": "66666666-6666-4666-8666-666666666666",
      "fileName": "contract.pdf",
      "mediaType": "application/pdf",
      "sizeBytes": 1024,
      "sha256": "aaaaaaaaaaaaaaaaaaaaaaaaaaaaaaaaaaaaaaaaaaaaaaaaaaaaaaaaaaaaaaaa",
      "download": {"url": "https://objects.example/contracts/contract.pdf", "expiresAt": "2026-07-13T19:00:00Z"}
    },
    "processing": {
      "languageHints": [],
      "documentCategory": "B2B_CONTRACT",
      "requestedOutputSchema": "m4trust.document-extraction-result",
      "requestedOutputSchemaVersion": "1.0.0",
      "privacyProfile": "DEFAULT",
      "retrievalProfile": "M4TRUST_LEGAL_DEFAULT"
    },
    "deadlineAt": "2026-07-13T18:30:00Z"
  }
}
