{
  "eventId": "18181818-1818-4181-8181-181818181818",
  "eventType": "ai.job.requested.v1",
  "schemaVersion": "1.0.0",
  "occurredAt": "2026-07-13T18:11:00Z",
  "correlationId": "13131313-1313-4131-8131-131313131313",
  "causationId": null,
  "jobId": "19191919-1919-4191-8191-191919191919",
  "jobType": "VIDEO_ANALYSIS",
  "tenantId": "15151515-1515-4151-8151-151515151515",
  "transactionId": "20202020-2020-4020-8020-202020202020",
  "subjectId": "21212121-2121-4121-8121-212121212121",
  "idempotencyKey": "video-full-2026-07-13",
  "producer": {"service": "m4trust-core", "version": "1.0.0"},
  "payload": {
    "input": {
      "videoId": "21212121-2121-4121-8121-212121212121",
      "fileName": "delivery-evidence.mp4",
      "mediaType": "video/mp4",
      "sizeBytes": 5849291,
      "sha256": "dddddddddddddddddddddddddddddddddddddddddddddddddddddddddddddddd",
      "download": {"url": "https://objects.example/videos/delivery-evidence.mp4", "expiresAt": "2026-07-13T19:10:00Z"}
    },
    "processing": {
      "analysisProfile": "DELIVERY_EVIDENCE_DEFAULT",
      "expectedObjects": [
        {"label": "sealed_box", "expectedCount": 4},
        {"label": "delivery_note", "expectedCount": 1}
      ],
      "requestedOutputSchema": "m4trust.video-analysis-result",
      "requestedOutputSchemaVersion": "1.0.0"
    },
    "deadlineAt": "2026-07-13T18:55:00Z"
  }
}
