{
  "eventId": "27272727-2727-4272-8272-272727272727",
  "eventType": "ai.job.cancel.requested.v1",
  "schemaVersion": "1.0.0",
  "occurredAt": "2026-07-13T18:20:00Z",
  "correlationId": "13131313-1313-4131-8131-131313131313",
  "causationId": "18181818-1818-4181-8181-181818181818",
  "jobId": "19191919-1919-4191-8191-191919191919",
  "jobType": "VIDEO_ANALYSIS",
  "tenantId": "15151515-1515-4151-8151-151515151515",
  "transactionId": "20202020-2020-4020-8020-202020202020",
  "subjectId": "21212121-2121-4121-8121-212121212121",
  "idempotencyKey": "video-full-2026-07-13-cancel",
  "producer": {"service": "m4trust-core-api", "version": "1.0.0"},
  "payload": {"reason": "USER_REQUESTED"}
}
