{
  "eventId": "77777777-7777-4777-8777-777777777777",
  "eventType": "ai.job.requested.v1",
  "schemaVersion": "1.0.0",
  "occurredAt": "2026-07-13T18:01:00Z",
  "correlationId": "22222222-2222-4222-8222-222222222222",
  "causationId": null,
  "jobId": "88888888-8888-4888-8888-888888888888",
  "jobType": "DOCUMENT_EXTRACTION",
  "tenantId": "44444444-4444-4444-8444-444444444444",
  "transactionId": "99999999-9999-4999-8999-999999999999",
  "subjectId": "aaaaaaaa-aaaa-4aaa-8aaa-aaaaaaaaaaaa",
  "idempotencyKey": "doc-full-2026-07-13",
  "producer": {"service": "m4trust-core", "version": "1.0.0"},
  "payload": {
    "input": {
      "documentId": "aaaaaaaa-aaaa-4aaa-8aaa-aaaaaaaaaaaa",
      "fileName": "supply-agreement-tr.pdf",
      "mediaType": "application/pdf",
      "sizeBytes": 248193,
      "sha256": "bbbbbbbbbbbbbbbbbbbbbbbbbbbbbbbbbbbbbbbbbbbbbbbbbbbbbbbbbbbbbbbb",
      "download": {"url": "https://objects.example/contracts/supply-agreement-tr.pdf", "expiresAt": "2026-07-13T19:05:00Z"}
    },
    "processing": {
      "languageHints": ["tr", "en"],
      "documentCategory": "B2B_CONTRACT",
      "requestedOutputSchema": "m4trust.document-extraction-result",
      "requestedOutputSchemaVersion": "1.0.0",
      "privacyProfile": "DEFAULT",
      "retrievalProfile": "M4TRUST_LEGAL_DEFAULT"
    },
    "deadlineAt": "2026-07-13T18:45:00Z"
  }
}
