{
  "eventId": "24242424-2424-4242-8242-242424242424",
  "eventType": "ai.job.completed.v1",
  "schemaVersion": "1.0.0",
  "occurredAt": "2026-07-13T18:14:40Z",
  "correlationId": "13131313-1313-4131-8131-131313131313",
  "causationId": "18181818-1818-4181-8181-181818181818",
  "jobId": "19191919-1919-4191-8191-191919191919",
  "jobType": "VIDEO_ANALYSIS",
  "tenantId": "15151515-1515-4151-8151-151515151515",
  "transactionId": "20202020-2020-4020-8020-202020202020",
  "subjectId": "21212121-2121-4121-8121-212121212121",
  "idempotencyKey": "video-full-2026-07-13-warning-result",
  "producer": {"service": "m4trust-ai-worker", "version": "1.0.0"},
  "payload": {
    "result": {
      "durationMs": 92000,
      "observations": [],
      "anomalies": [
        {"anomalyReference": "anomaly-1", "type": "VISIBILITY_GAP", "severity": "MEDIUM", "description": "The evidence is not visible for part of the expected interval.", "confidence": 0.86, "timeRange": {"startMs": 50000, "endMs": 65000}}
      ],
      "summary": {"advisoryOutcome": "REVIEW_SUGGESTED", "reviewReasons": ["VIDEO_VISIBILITY_GAP"]}
    },
    "technicalMetadata": {"pipelineVersion": "video-pipeline-1.0.0", "modelProvider": "internal-model-service", "modelFamily": "delivery-evidence", "modelVersion": "2026-07", "promptVersion": null, "retrievalVersion": null, "parserVersion": "video-parser-1.0.0", "privacyVersion": "default-1", "durationMs": 12600},
    "warnings": [
      {"code": "VIDEO_VISIBILITY_GAP", "message": "A portion of the video did not provide sufficient visual evidence.", "severity": "WARNING", "path": "#/result/anomalies/0", "details": {"field": "timeRange", "reason": "visibility gap", "expected": "continuous evidence", "observed": "partial evidence"}},
      {"code": "LOW_CONFIDENCE_RESULT", "message": "The advisory result has reduced confidence.", "severity": "INFO", "path": "#/result/summary", "details": null}
    ]
  }
}
